{
  "schema_version": "1.0",
  "request_id": "req_handoff_001",
  "source": "photon_message",
  "include_gmail": true,
  "gmail_account_id": "demo",
  "open_loops": [
    {
      "id": "ol_001",
      "text": "明天记得回复李老师",
      "desired_time": "tomorrow_morning"
    },
    {
      "id": "ol_002",
      "text": "首页深色模式按钮还没检查",
      "desired_time": "tomorrow"
    }
  ],
  "response_channel": "imessage",
  "timezone": "Asia/Shanghai",
  "locale": "zh-CN"
}
